<?xml version="1.0" encoding="UTF-8"?>
<event xsi:noNamespaceSchemaLocation="../dtd/workflowEvent.xsd" xmlns:xsi="http://www.w3.org/2001/XMLSchema-instance">
	<send>
		<action class="">
			<condition type="flow-type" value="" />
		</action>
	</send>
	<workflow-create>
		<action class="">
			<condition type="flow-type" value="EDOC"/>
		</action>
	</workflow-create>
	<workflow-end>
		<!-- <action class="net.mast.workflow.eventListening.PrApplyProcessEndEventListning">
			<condition type="flow-type" value="ProcessType_abf73323e70" />
		</action>
		<action class="net.mast.workflow.eventListening.HeadPrApplyProcessEndEventListning">
			<condition type="flow-type" value="headworkflow" />
		</action> -->
		<action class="">
			<condition type="flow-type" value="" />
		</action>
	</workflow-end>
	<app-data>
	    <action class="">
			<condition type="flow-type" value="" />
		</action>
	</app-data>
	<log>
		<action class="">
			<condition type="flow-type" value="EDOC" />
		</action>	
	</log>
</event>
